{
  "genre": "technical",
  "purpose": "Turn sparse incident notes into a complete draft without inventing detail.",
  "audience": "Engineers reviewing the incident",
  "expected_action": "rewrite",
  "intervention_mode": "from-notes",
  "source": {
    "kind": "synthetic",
    "citation": "Created in this repository as a deterministic regression fixture."
  },
  "protected_facts": ["API v2", "2:14 a.m.", "Nagpur", "nine minutes", "expired cache key", "Mira"]
}
